{
  "format": "vpms-runtime-activation-scope/v1",
  "artifact_class": "DEVELOPER_ACTIVATION_PROVENANCE",
  "normative_authority": false,
  "base_head": "7dd0adc39aa33f67fcc20a6db52a488bae0060a1",
  "approval": {
    "decision": "APPROVED",
    "decision_source": "USER_EXPLICIT",
    "source_reference": "2026-10-05 Project Owner provided the completed/unfinished VPMS evaluation and requested completing the remaining work. This is the successor activation, integration and retirement approval, not a rewrite of earlier materialization-only approvals.",
    "runtime_activation_authorized": true,
    "selector_retirement_authorized": true,
    "run_selected_cases_retirement_authorized": true,
    "sfp_0006_retirement_authorized": true,
    "sfp_0023_activation_authorized": true,
    "public_api_transition_authorized": true,
    "automatic_commit_push_authorized": true,
    "purpose_field_removal_authorized": false,
    "raw_profile_reader_retirement_authorized": false,
    "agent_contract_digest_activation_authorized": false
  },
  "prior_records": {
    "developer/policy/registries/vpms-contract-materialization.json": "3a4b0f8aeb575252b33564dac63c622ade8a74e2aea2d5464541fbf5ba698e23",
    "developer/policy/registries/vpms-api-implementation.json": "0010e88fe095dd85147ebab35ef6f2a88f9e9aebc9f17f5cedab9de104d9297d"
  },
  "hash_role": "LOCAL_LF_BYTE_AUDIT_NOT_NORMATIVE_SEMANTIC_DIGEST",
  "provider_binding": "ptsip.validation.handoff:load_validated_effective_map",
  "product_target": {"status": "ACTIVE", "runtime_enabled": true, "capability": "ACTIVE"},
  "support_targets": {"SFP-0006": "RETIRED", "SFP-0023": "ACTIVE"},
  "authorized_preservation_changes": {
    "src/policy/SFP-0006.yaml": "MODIFY_LIFECYCLE_ONLY",
    "src/vpms/__init__.py": "MODIFY",
    "src/vpms/domain/selector.py": "DELETE",
    "src/vpms/execution/runner.py": "MODIFY",
    "src/vpms/integration/ptsip_bridge.py": "MODIFY"
  },
  "mutation_targets": [
    "README.md",
    "developer/policy/registries/vpms-runtime-activation.json",
    "developer/policy/schemas/vpms-runtime-activation.schema.json",
    "developer/automation/vpms_runtime_activation.py",
    "developer/automation/support_contract_registration.py",
    "developer/automation/vpms_api_implementation.py",
    "developer/tests/test_vpms_runtime_activation.py",
    "developer/tests/test_vpms_contract_registration.py",
    "developer/tests/test_vpms_api_implementation.py",
    "developer/tests/test_support_policy_location.py",
    "developer/tests/test_developer_control_plane.py",
    "src/ptsip/validation/handoff.py",
    "src/tests/ptsip/validation/test_effective_map_handoff.py",
    "src/vpms/__init__.py",
    "src/vpms/domain/selector.py",
    "src/vpms/execution/runner.py",
    "src/vpms/integration/ptsip_bridge.py",
    "src/vpms/contract_runtime.py",
    "src/vpms/contracts/index.json",
    "src/vpms/contracts/protocol.json",
    "src/vpms/contracts/selection.json",
    "src/vpms/contracts/execution-composition.json",
    "src/vpms/contracts/schemas/catalog.schema.json",
    "src/vpms/contracts/schemas/product-contract.schema.json",
    "src/policy/SFP-0006.yaml",
    "src/policy/SFP-0023.yaml",
    "src/policy/index.yaml",
    "src/policy/schemas/ptsip-support-authority-semantics.schema.json",
    "developer/profiles/ptsip-repository.yaml",
    ".ptsip/profiles/main.ptsip.yaml",
    "src/tests/vpms/domain/test_selector_035.py",
    "src/tests/vpms/domain/test_snapshot.py",
    "src/tests/vpms/selection/test_resolver.py",
    "src/tests/vpms/execution/test_selective_execution_035.py",
    "src/tests/vpms/execution/test_composition.py",
    "src/tests/vpms/integration/test_repository_self_adoption_035.py",
    "src/tests/vpms/integration/test_ptsip_effective_map_036.py",
    "src/tests/vpms/integration/test_ptsip_bridge_035.py",
    "src/tests/vpms/integration/test_validated_handoff.py",
    "src/tests/vpms/architecture/test_public_surface_035.py",
    "src/tests/vpms/contracts/test_product_contracts.py",
    "src/tests/vpms/contracts/test_runtime_entry.py",
    "src/tests/vpms/contracts/test_installed_contracts.py"
  ]
}
